Artikelnummer,FAQ
JL368A,"Wofür wird das JL368A verwendet?||Das JL368A ist das Management-Modul (Control-Plane) für die Aruba-CX-8400-Chassis und steuert Routing, Switching und Chassis-Management.##In welche Chassis passt das JL368A?||Das JL368A ist mit den Chassis der Serie Aruba CX 8400 kompatibel und belegt einen Management-Modul-Steckplatz.##Ist das JL368A ein eigenständiger Switch?||Nein. Das JL368A ist ein Management-Modul und benötigt ein kompatibles Aruba-CX-8400-Chassis sowie Linecards.##Ist das JL368A ungebraucht?||Ja."
JL367A,"Wofür wird das JL367A verwendet?||Das JL367A ist ein Fabric-Modul (7,2 Tbit/s) und bildet die zentrale Switching-Fabric des Aruba-CX-8400-Chassis.##In welches Chassis passt das JL367A?||Das JL367A ist mit dem Chassis der Serie Aruba CX 8400 kompatibel und belegt einen Fabric-Modul-Steckplatz.##Ist das JL367A ein eigenständiger Switch?||Nein. Das JL367A ist ein Fabric-Modul und benötigt ein kompatibles Aruba-CX-8400-Chassis.##Ist das JL367A ungebraucht?||Ja."
JL363A,"Wofür wird die JL363A verwendet?||Die JL363A ist eine Linecard (32× 10G SFP+ (MACsec)) für die modularen Aruba-CX-8400-Chassis.##In welche Chassis passt die JL363A?||Die JL363A ist mit den Chassis der Serie Aruba CX 8400 kompatibel und belegt einen Linecard-Steckplatz.##Unterstützt die JL363A PoE?||Nein. Die JL363A ist eine Linecard ohne Power over Ethernet.##Ist die JL363A ungebraucht?||Ja."
JL365A,"Wofür wird die JL365A verwendet?||Die JL365A ist eine Linecard (8× 40G QSFP+) für die modularen Aruba-CX-8400-Chassis.##In welche Chassis passt die JL365A?||Die JL365A ist mit den Chassis der Serie Aruba CX 8400 kompatibel und belegt einen Linecard-Steckplatz.##Unterstützt die JL365A PoE?||Nein. Die JL365A ist eine Linecard ohne Power over Ethernet.##Ist die JL365A ungebraucht?||Ja."
JL366A,"Wofür wird die JL366A verwendet?||Die JL366A ist eine Linecard (6× 40/100G QSFP28) für die modularen Aruba-CX-8400-Chassis.##In welche Chassis passt die JL366A?||Die JL366A ist mit den Chassis der Serie Aruba CX 8400 kompatibel und belegt einen Linecard-Steckplatz.##Unterstützt die JL366A PoE?||Nein. Die JL366A ist eine Linecard ohne Power over Ethernet.##Ist die JL366A ungebraucht?||Ja."
JL687A,"Wofür wird die JL687A verwendet?||Die JL687A ist eine Linecard (32× 1/10/25G SFP/SFP+/SFP28) für die modularen Aruba-CX-8400-Chassis.##In welche Chassis passt die JL687A?||Die JL687A ist mit den Chassis der Serie Aruba CX 8400 kompatibel und belegt einen Linecard-Steckplatz.##Unterstützt die JL687A PoE?||Nein. Die JL687A ist eine Linecard ohne Power over Ethernet.##Ist die JL687A ungebraucht?||Ja."
